Title,Company,Location,Short Description,Link
Data Analyst,Western Health,St Albans,"A unique opportunity exists to join the Western Public Health Unit in the role of Data Analyst within the Data, Epidemiology, and Surveillance team.",https://www.seek.com.au/job/86244018?type=standard&ref=search-standalone&origin=cardTitle#sol=61cc5a58788a975ad5f1e4a28abb50a20d64c91e
Population Health Data Analyst,South Eastern Melbourne Primary Health Network,Heatherton,Analyse data to drive population health planning,https://www.seek.com.au/job/86312389?type=standard&ref=search-standalone&origin=cardTitle#sol=613c709de69c6a4b9c05d60007470d2002904460
Data Analyst,Western Health,Williamstown,Drive data-driven insights and improve organisational performance at Western Health.,https://www.seek.com.au/job/86238954?type=standard&ref=search-standalone&origin=cardTitle#sol=dfa0f853cd284b141a0cd192f42c5004d592c0d5
Data Analyst,Western Health,Footscray,"Excellent data management and problem skills, a strong eye for detail, and the ability to apply your analytical and critical thinking...",https://www.seek.com.au/job/86244700?type=standard&ref=search-standalone&origin=cardTitle#sol=c760dc6bfff4eb3b5cd9a854f7c86cbd7dbaf6b0
Senior Analyst,Alfred Health,Melbourne VIC,"Permanent Full Time (1.0 EFT / 80 Hours) + ADO
Managers and Administrative Worker Grade 5
Location: The Alfred 541 St Kilda Road
Great Staff Benefits",https://www.seek.com.au/job/86301836?type=standard&ref=search-standalone&origin=cardTitle#sol=a2dd63ba4a6b95cc398e0aa6d24687430a929591
Graduate Reporting Analyst,Teachers Health Fund,Sydney NSW,"Start your data career with purpose, impact, and growth at Teachers Healt",https://www.seek.com.au/job/86332428?type=standard&ref=search-standalone&origin=cardTitle#sol=e5bc2dea8f67c840785291b0024060457ad55b55
Drug and Alcohol Data Support Officer,Northern Sydney Local Health District,St Leonards,Utilise your training and resource development skills to assist clinicians in mastering the electronic medical records for positive health outcomes.,https://www.seek.com.au/job/86241752?type=standard&ref=search-standalone&origin=cardTitle#sol=0c561d1713eeff79f48526059d5f4b81fb6869c8
Data Analyst - Ability Roundtable,Ability First Australia,Sydney NSW,"Join the leader in disability sector benchmarking, driving service improvements for members and better outcomes for people with disability.",https://www.seek.com.au/job/85660319?type=standard&ref=search-standalone&origin=cardTitle#sol=c1e6dc28a1575325ab72ba51bb30313bc8a4b50a
Technical Analyst,Independent Health and Aged Care Pricing Authority,Sydney NSW,IHACPA is looking for a motivated Technical Analyst to join the Aged Care Pricing section,https://www.seek.com.au/job/85825048?type=standard&ref=search-standalone&origin=cardTitle#sol=105a0e6bb643ac7ef3d4a3dc6a2ed34ac6998a1d
Data Officer,Western Health,St Albans,"The Data Officer supports data management, reporting, and quality assurance for AOD programs, ensuring accurate submissions & performance monitoring",https://www.seek.com.au/job/86185375?type=standard&ref=search-standalone&origin=cardTitle#sol=65b0af7914c589a09d076a3b2e32354abc6bb658
Junior Data Analyst,Trilogy Care Pty Ltd,Brisbane QLD,"Be part of the future of aged care. Use Databricks, AI, and analytics to create better outcomes for our clients and more time for human connection.",https://www.seek.com.au/job/86335488?type=standard&ref=search-standalone&origin=cardTitle#sol=d2968ad5bc9a3305513aa31a30997f6b222fd9fa
Informatics Officer,Metro South Health,Cleveland,"Join Metro South Health as an Informatics Officer. Ensure data quality, enjoy flexible work, great benefits, and grow your career!",https://www.seek.com.au/job/86085162?type=standard&ref=search-standalone&origin=cardTitle#sol=179d67d28df448b06b8acc07b005b17074aec89e
Graduate Reporting Analyst,Teachers Health Fund,Brisbane QLD,"Start your data career with purpose, impact, and growth at Teachers Healt",https://www.seek.com.au/job/86344234?type=standard&ref=search-standalone&origin=cardTitle#sol=9837ef4cbae24e5ee795436576a34418f39a3fc6
Project Coordinator,WorkSafe Victoria,Melbourne VIC,"Help shape the future of workplace safety in Victoria, while growing your career in a supportive environment",https://www.seek.com.au/job/86257388?type=standard&ref=search-standalone&origin=cardTitle#sol=4ba5145d70ff8253bc221bdfceda859940975971
"APS6 Project Officer, Indicator Development",Australian Commission on Safety and Quality in Health Care,Sydney NSW,"The role contributes the Indicator Development team's work with focus on the development, revision and implementation of safety and quality indicators",https://www.seek.com.au/job/86274217?type=standard&ref=search-standalone&origin=cardTitle#sol=2d0c181e7bc5c486d7d9e4fbd1050991911f7e2d
Digital Patient Navigator,Valion Health,Melbourne VIC,"The Patient Navigator has an integral role at Valion Health, assist participants as well as support management, team and referring organisations.",https://www.seek.com.au/job/86051653?type=standard&ref=search-standalone&origin=cardTitle#sol=162fb89c19a431dc97734eb59d75455db7b22418
Customer Support Data Analyst,Mazda Australia,Mulgrave,Drive impact with data — turn insights into action and shape exceptional customer experiences as Mazda’s Customer Service Data Analyst.,https://www.seek.com.au/job/86049877?type=standard&ref=search-standalone&origin=cardTitle#sol=8b7719ed5dd062f151bfa2f0ed8711b571614b3a
Data Specialist - Clinical Trials,Chris O'Brien Lifehouse,Camperdown,Transform cancer care through data-driven clinical trials research as Part Time Data Specialist at Lifehouse,https://www.seek.com.au/job/86062126?type=standard&ref=search-standalone&origin=cardTitle#sol=66ce7299d714dc68a3b4506e08e9a833304e242d
Data Cleansing Officer,Department of Health - Queensland,Bowen Hills,"Identify, analyse and cleanse data to identify discrepancies, inaccuracies, or outdated information",https://www.seek.com.au/job/86214808?type=standard&ref=search-standalone&origin=cardTitle#sol=25abc7d0dd2c8251207fec302e025369f1b08d2b
Junior/Intermediate Data Analyst,Hyundai Rotem Company,North Ryde,Data driven analytical thinker with a passion for turning complex datasets into actionable insights!,https://www.seek.com.au/job/86342226?type=standard&ref=search-standalone&origin=cardTitle#sol=ed09a9e85e375e23b74da8e3ef01d2ccad4cf854
Data Analyst,University of Wollongong,Wollongong,"Support national palliative care improvements through data analysis, dashboard development, and innovation at UOW’s Innovation Campus.",https://www.seek.com.au/job/86259307?type=standard&ref=search-standalone&origin=cardTitle#sol=74df855ad5793ebefd21617d010555b7b8635a82
Cancer Senior Data and Information Analyst,Grampians Health,Ballarat,Join a dynamic team committed to excellence in healthcare with a rewarding role. Your journey to meaningful work starts here.,https://www.seek.com.au/job/85906214?type=standard&ref=search-standalone&origin=cardTitle#sol=80d3626fdc292b2b23599417b44207530f3bcfef
Data Migration Analyst,Dynamo Recruitment,Melbourne VIC,"Exciting permanent hybrid role in Melbourne with a global organisation, supporting leading healthcare providers in their transition to EHR systems.",https://www.seek.com.au/job/86234099?type=standard&ref=search-standalone&origin=cardTitle#sol=a27370b6db6b659b80be4a9b01ea66f32a4c61c0
Data Manager,Metro South Health,Brisbane QLD,"Seeking an experienced Data Manager to support Bayside Executive, focusing on data quality across Corporate, Clinical Governance, and Departments",https://www.seek.com.au/job/86219753?type=standard&ref=search-standalone&origin=cardTitle#sol=da5a743e91000e5cad2a1fb502e2eb0a8042afc3
Business Intelligence & Data Analyst,Robert Half,Melbourne VIC,"Join a healthcare organisation focused on data excellence. Support informed decisions with timely, accurate insights across teams and services.",https://www.seek.com.au/job/86084158?type=standard&ref=search-standalone&origin=cardTitle#sol=186ea9f9b2df12419dccaf627851afc70de6976e
Data Analyst,Reserve Bank of Australia,Sydney NSW,Join the Economic Analytical & Technical Services team to develop & maintain the Banks data infrastructure.,https://www.seek.com.au/job/86333520?type=standard&ref=search-standalone&origin=cardTitle#sol=4ad7cd41ada02ed70f7d79375b507ee65db91462
Principal Workforce Analyst,South West Hospital and Health Service,Roma,Building better health in the bush,https://www.seek.com.au/job/86252776?type=standard&ref=search-standalone&origin=cardTitle#sol=a66644da39d062a2b1c34722597e347322d160b9
Business Intelligence Analyst,HammondCare,St Leonards,"Immediate start, 6 months contract, min 2 year's experience with strong tech background in BI & Data Analytics required",https://www.seek.com.au/job/86212495?type=standard&ref=search-standalone&origin=cardTitle#sol=2abecd5065c710deccdb466f96cfd3544b3a1dfa
Principal Business Analyst,Department of Health - Queensland,Fortitude Valley,"Great opportunity for experienced Principal Business Analysts to join our team to innovate, deliver and drive effective ICT solutions",https://www.seek.com.au/job/86284184?type=standard&ref=search-standalone&origin=cardTitle#sol=dfa49f1e6eec7b2f16396648d266fa2317ab53e5
Clinical Research Assistant (Clinical Genomics),St Vincent’s Hospital Sydney,Darlinghurst,Fantastic opportunity to support clinical genomics research for a leader in the healthcare sector!,https://www.seek.com.au/job/85907611?type=standard&ref=search-standalone&origin=cardTitle#sol=05de02a295221de9c0cea86cca46000fe0a6cc35
Data & Reporting Analyst (6 Month FTC),DYE & DURHAM PTY LTD,Melbourne VIC,We are looking for an energetic Reporting Analyst to join our team!,https://www.seek.com.au/job/86245186?type=standard&ref=search-standalone&origin=cardTitle#sol=5f809dbbcb0b99ca7a49fc698961ac84975879dc
Research Assistant,Mater Group,South Brisbane,Mater Research are looking for a Research Assistant to join the Biobank team! This permanent full-time role will be based at our South Brisbane campus,https://www.seek.com.au/job/86221033?type=standard&ref=search-standalone&origin=cardTitle#sol=3272cd6e9421aafd08f1cdfaf1d42e9ddee47fc7
Data Entry,Douglas & Mann Pty Ltd t/as Histopath,Macquarie Park,"Join our team! Ensure accurate records, support workflows, and thrive in a fast-paced role where your attention to detail shines.",https://www.seek.com.au/job/86313282?type=standard&ref=search-standalone&origin=cardTitle#sol=7a7cff90819c11c44a0e0915ece519f23fb9875b
"Solution Specialist (Microsoft 365), Queensland Health",Department of Health - Queensland,South Brisbane,"Work with key stakeholders and other subject matter experts, to design, develop and deploy custom Microsoft 365 solutions. This will include...",https://www.seek.com.au/job/86292244?type=standard&ref=search-standalone&origin=cardTitle#sol=adf8c5bceb77bbbbcf0e7b97e4e946e5be7cbb5f
Data Migration Officer,Department of Health - Queensland,Bowen Hills,"Provide expertise in the planning, implementation, and oversight of data migration initiatives across departmental systems",https://www.seek.com.au/job/86215086?type=standard&ref=search-standalone&origin=cardTitle#sol=0f9eca91cabac131b0b8060a1e88b4ff46a75fb2
Business Analyst,EBOS Group Ltd,Milton,Centralised reporting role with TerryWhite Chemmart,https://www.seek.com.au/job/86304536?type=standard&ref=search-standalone&origin=cardTitle#sol=afc53b37e41a79243910136cfecf8821f3d12b62
BI Reporting Specialist,Bolton Clarke,Kelvin Grove,Join Bolton Clarke as a BI Reporting Specialist and help shape the future of data-driven decision-making in aged care.,https://www.seek.com.au/job/86345008?type=standard&ref=search-standalone&origin=cardTitle#sol=249c53ba191681f1e86b23cfa79fd624d0ac3166
Research Assistant,Macquarie University,North Ryde,"Support impactful research in a dynamic team. Use your skills in ethics, writing, and data to drive real outcomes in health and innovation.",https://www.seek.com.au/job/86357049?type=standard&ref=search-standalone&origin=cardTitle#sol=906e8928d1d4543796251ba47a72a42a68c11556
Data Linkage Analyst,SA Health - Dept for Health and Wellbeing,Adelaide SA,"Responsible forthe preparation, cleaning and preloading of data for linkage, to support high quality linkage of records into the data linkage system",https://www.seek.com.au/job/86237378?type=standard&ref=search-standalone&origin=cardTitle#sol=f0cc168468b205c213a161ddc2141458fd80438b
Data & Analytics Manager - Local Public Health Unit,Goulburn Valley Health,Shepparton,GV Health's Local Public Health Unit is seeking a highly motivated and skilled individual to join their dynamic team as Data & Analytics Manager.,https://www.seek.com.au/job/86332002?type=standard&ref=search-standalone&origin=cardTitle#sol=dda6050a156cc2148030fa5a0dd91bca95c8bcf4
Junior Test Analyst,Australian Healthcare Associates,Melbourne VIC,We’re currently seeking a Junior Test Analyst to join our IT team to help with the delivery of quality software applications.,https://www.seek.com.au/job/86284021?type=standard&ref=search-standalone&origin=cardTitle#sol=4ecdda1b182d83b1681eb8222d3d853911855fe6
"EL1 Senior Project Officer, Indicator Development",Australian Commission on Safety and Quality in Health Care,Sydney NSW,"This position will have a focus on the on the development, revision and implementation support of safety and quality indicators.",https://www.seek.com.au/job/86239496?type=standard&ref=search-standalone&origin=cardTitle#sol=a6633015dff42d2c6492952d28580fdddc165737
Data Analyst,Woolworths Group,Norwest,Supporting the Category Manager Insights & Tools team,https://www.seek.com.au/job/86310084?type=standard&ref=search-standalone&origin=cardTitle#sol=45b25eb8fa73e56b9e347ac297df79ad9950f217
Primary Healthcare Information Specialist,Royal Flying Doctor Service WA,Jandakot,"Optimise practice management systems, streamline workflows & improve data quality across RFDS primary care. Help drive better healthcare outcomes.",https://www.seek.com.au/job/85970857?type=standard&ref=search-standalone&origin=cardTitle#sol=23c5ecd70e9755aa39c268006bb2028fa76a1c6d
Junior Research Data Engineer,The Walter and Eliza Hall Institute,Parkville,The Walter and Eliza Hall Institute of Medical Research (WEHI) is one of Australia's leading biomedical research organisations.,https://www.seek.com.au/job/86283377?type=standard&ref=search-standalone&origin=cardTitle#sol=29f5b6551af69b8b8e542afc56069625f7a7430f
Project Officer,Australian Primary Health Care Nurses Association,Melbourne VIC,"Join APNA as a Project Officer. Make a difference, enjoy flexibility, salary packaging and grow your skills in a supportive and purpose driven team.",https://www.seek.com.au/job/86120884?type=standard&ref=search-standalone&origin=cardTitle#sol=2881a6bdea4f41750c45c9706d33ace592dad26e
Senior Business Data Analyst,Hudson,Macquarie Park,"Seeking a Commercial/Business Analyst with strong Excel skills to deliver insights, forecasting & reporting in a flexible hybrid APAC role.",https://www.seek.com.au/job/86257124?type=standard&ref=search-standalone&origin=cardTitle#sol=22c49fde4d5932b337eaa40607382762bdaaa0bd
"EL1 Senior Project Officer, Indicator Development",Australian Commission on Safety and Quality in Health Care,Sydney NSW,"This position will have a focus on the on the development, revision and implementation support of safety and quality indicators.",https://www.seek.com.au/job/86239496?type=standard&ref=search-standalone&origin=cardTitle#sol=647ffe3c968d5d7c1c448171e57a861695cedc55
System Business Analyst (12-month 1.0 FTE),South Eastern Melbourne Primary Health Network,Heatherton,Enhance CRM systems to support healthcare delivery,https://www.seek.com.au/job/86284125?type=standard&ref=search-standalone&origin=cardTitle#sol=796c43f2be048275692d14ebf32f6bc46aa1bc9d
Systems Support Officer,Australian Primary Health Care Nurses Association,Melbourne VIC,"Experience in systems administration and support, and want to make a real difference? Join us!  Vibrant team | Donuts | Salary packaging benefits",https://www.seek.com.au/job/86241085?type=standard&ref=search-standalone&origin=cardTitle#sol=cde4ae925b0e25a4e8d02807d0fa18e05c89f4c0
"Manager, Data Strategy Management",Department of Health - Queensland,Brisbane QLD,"The Manager, Data Strategy and Management, within the Health Infrastructure Queensland will lead a small team responsible for all the development",https://www.seek.com.au/job/86091365?type=standard&ref=search-standalone&origin=cardTitle#sol=f52531e43c7141e70effbeff11126a20c9ceadaf
Business Analyst,Department of Health,Launceston,We are seeking four highly motivated business analysts to support the clinical and corporate teams within Launceston General Hospital,https://www.seek.com.au/job/86277168?type=standard&ref=search-standalone&origin=cardTitle#sol=b5008fc32f71eeaff277f5b3c63a01dec7819096
Revenue Analyst,The Royal Melbourne Hospital,Parkville,Play a crucial part in ensuring the smooth operation of our revenue cycle and maximising private patient revenue.,https://www.seek.com.au/job/86156979?type=standard&ref=search-standalone&origin=cardTitle#sol=65d3293d9a5132e15929752267b028015643c359
APS Level 6 - Technical Analyst,Australian Department of Health,Sydney NSW,The Independent Health Aged Care Pricing Authority (IHACPA) is looking for a motivated Technical Analyst to join the Aged Care Pricing section. The...,https://www.seek.com.au/job/85750053?type=standard&ref=search-standalone&origin=cardTitle#sol=8bb4cf5f9d42426a75693d7604077a355c4f81ae
Power BI Developer,BlueCare,Toowoomba,Join the team at BlueCare as a Power BI Analyst/ Developer and lead the development of reporting solutions,https://www.seek.com.au/job/86313933?type=standard&ref=search-standalone&origin=cardTitle#sol=e2960fd8f5f56d641f2b1c2c0f4d7124549c1a04
"Strategy Lead, Private Hospitals",St Vincent's Health Australia,Melbourne VIC,Lead the strategic & service planning initiatives from conceptualisation through to implementation at St Vincent's focusing on our Private Hospitals,https://www.seek.com.au/job/85952498?type=standard&ref=search-standalone&origin=cardTitle#sol=17e7e4220d3776e2d7f54a2d6faa16b49490dc33
Data Engineer,The Royal Melbourne Hospital,Parkville,Full time permanent Data Engineer role - Hybrid and flexible work arrangements,https://www.seek.com.au/job/86221951?type=standard&ref=search-standalone&origin=cardTitle#sol=8abf97c750cf7a2b7229de73e997dce02a3fbc23
EMR Clinical Informatics Officer - SNOW Centre Project,The Royal Melbourne Hospital,Parkville,"Bridging clinical care and research, this role will support groundbreaking discoveries and improved patient outcomes in immune health.",https://www.seek.com.au/job/86280077?type=standard&ref=search-standalone&origin=cardTitle#sol=888db5c60688c4f5ba85e48cb9d22d1aab8a14ea
Finance Analyst,Stryker,St Leonards,"Strategically partner with key stakeholders to provide insight, highlight opportunities and enhance business performance.",https://www.seek.com.au/job/86349104?type=standard&ref=search-standalone&origin=cardTitle#sol=51e7bbc2ec0ef644e336d9008e839e9482e8c360
Data and Reporting Manager,Quinn Allan,North Sydney,We are looking for a Data & Reporting Manager to join a health institution North of Sydney on a 12-months Fixed Term Contract with possible extension.,https://www.seek.com.au/job/86096728?type=standard&ref=search-standalone&origin=cardTitle#sol=f5deab5a5ff8fb29f5253a878ef5020fdddd2009
Principal Cardiac Informatics Analyst,Metro North Hospital & Health Service,Fortitude Valley,"Provide a superior level of programming skill, technical expertise and advice to achieve specified business objectives",https://www.seek.com.au/job/86015349?type=standard&ref=search-standalone&origin=cardTitle#sol=32c77a7dee3c2003a6913177c9d4a647fb4423f4
ICT Business Analyst,Peoplebank Australia WA,Perth WA,ICT Business Analyst     Initial 6 month contracts based in the Perth CBD  Ideally seeking health / clinical background  Analysis of ICT data /,https://www.seek.com.au/job/86293372?type=standard&ref=search-standalone&origin=cardTitle#sol=0c25c5953a03f3a410e5aaf46197055e496bb47e
Data Assurance and Audit Officer,Western Health,Williamstown,"Coordinate key health datasets and drive data quality to support funding, planning, and patient care at Western Health.",https://www.seek.com.au/job/86183120?type=standard&ref=search-standalone&origin=cardTitle#sol=cf58f3f95e8098e2d8be949cff69598e1635b992
Business Analyst,Australian Healthcare Associates,Melbourne VIC,Join Australian Healthcare Associates and be part of a team dedicated to the enhancement and support of critical business systems.,https://www.seek.com.au/job/86078366?type=standard&ref=search-standalone&origin=cardTitle#sol=1afff127998f3e158e01600b23b74fe76aaf0ee0
Data Analyst - AU,Eucalyptus,New South Wales,"Founded in Australia in 2019, we have now helped over 500K patients globally by combining technology, design and operational excellence to help...",https://www.seek.com.au/job/85865567?type=standard&ref=search-standalone&origin=cardTitle#sol=fa15eb5a6014cc852d4b4dd2efcead37639ea0b5
Customer Insights Analyst,Programmed,Burswood,Programmed are seeking a Customer Insights Analyst to join the team supporting our Facility Management contracts in WA,https://www.seek.com.au/job/86252999?type=standard&ref=search-standalone&origin=cardTitle#sol=e46e4ef9b4abc367982d55185e1c4f9781f81118
Senior Information Analyst,Department of Training and Workforce Development,Osborne Park,Participates in many of the Performance Evaluation and Statistics branch’s operations.,https://www.seek.com.au/job/86249236?type=standard&ref=search-standalone&origin=cardTitle#sol=bef52817996fca4ca711dc9368b97f8f16d073a6
Quality & Learning Administrator,Royal Rehab,Milsons Point,"Drive digital change in healthcare! Join us as a Systems Analyst & Administrator and power better care through data, insights, and smart systems.",https://www.seek.com.au/job/85827887?type=standard&ref=search-standalone&origin=cardTitle#sol=649aa04fb40d168e2d46d5310ffdbca726edfdca
Analyst,Colliers,Sydney NSW,Seeking a proactive Analyst to support demographic and property market data analysis in the healthcare and retirement living sector.,https://www.seek.com.au/job/86145583?type=standard&ref=search-standalone&origin=cardTitle#sol=48504dc5416d6294bf6cb51b505bf8e6a4f1cf81
Clinical Business Analyst,Tenacity CX,Canberra ACT,Clinical Business Analyst who has experience working on ICT projects to deliver a healthcare solution.,https://www.seek.com.au/job/86275141?type=standard&ref=search-standalone&origin=cardTitle#sol=6ac7666bdaf05859d346022443a434e41e7903b6
Analytics Coordinator,VMIA,Melbourne VIC,"Seeking a graduate with excellent customer service experience to deep dive in multiple technical platforms, coding and exciting projects.",https://www.seek.com.au/job/86206592?type=standard&ref=search-standalone&origin=cardTitle#sol=8b021aba9f0cb9e01935e60d6c348fc7a39abaf5
Workforce Analyst,Australian Unity,Melbourne VIC,"Play a key role in enabling efficient and effective call center operations through accurate forecasting, capacity planning, and scheduling",https://www.seek.com.au/job/86251248?type=standard&ref=search-standalone&origin=cardTitle#sol=bce4d7b30d59a83e9564f9afca7c01375e8b349e
Marketing Manager,Boston Scientific,Mascot,"Lead marketing for Neuromodulation Pain therapies—drive strategy, referrals, digital, and launches across ANZ.",https://www.seek.com.au/job/86318986?type=standard&ref=search-standalone&origin=cardTitle#sol=7f40607327d44eb0395d5a8e1c203b5eacab396d
Airport Operations Support Analyst,Western Sydney Airport,Luddenham,"Drive smooth airport operations with roster coordination, data insights, and cross-team support in a fast-paced environment.",https://www.seek.com.au/job/86302051?type=standard&ref=search-standalone&origin=cardTitle#sol=98239ac2e209532dc7e6d7e545fcf3a1780d275e
Data Engineer,Healthcare Logic,Bundall,"If you’re passionate about data with purpose and want to see your work directly improve healthcare systems, this is your moment.",https://www.seek.com.au/job/86079805?type=standard&ref=search-standalone&origin=cardTitle#sol=c2aed8f3c36a7c284cc5cc733a32f7e916fc5eb2
Research Assistant,East Metropolitan Health Service,Perth WA,Permanent Full time or Fixed term Full time,https://www.seek.com.au/job/86171771?type=standard&ref=search-standalone&origin=cardTitle#sol=a1e6edd65dafbc621251c18e4a5af4b5313369ab
Research Governance Administrator,Metro North Hospital & Health Service,Herston,Permanent full time opportunity to provide technical and expert support and advice to researchers.,https://www.seek.com.au/job/86269516?type=standard&ref=search-standalone&origin=cardTitle#sol=33f99e0c9910cb897ef6e46077a89c4497e916b1
"Strategy Lead, Private Hospitals",St Vincent's Health Australia,Sydney NSW,Lead the strategic & service planning initiatives from conceptualisation through to implementation at St Vincent's focusing on our Private Hospitals,https://www.seek.com.au/job/85952635?type=standard&ref=search-standalone&origin=cardTitle#sol=909381852b6105b48e2a0f506aeab6f597e158cf
Business Intelligence Officer,Anglicare WA,East Perth,Boost Anglicare WA’s reputation—champion strong governance and showcase results through our Outcomes Measurement Framework.,https://www.seek.com.au/job/86271891?type=standard&ref=search-standalone&origin=cardTitle#sol=2018cf697f031a7e2bf40861093bca616c85471e
BI Developer,ASIC,Melbourne VIC,"ASIC's Data, Analytics and AI Team is hiring a BI Developer to design and deliver essential Power BI reports for business intelligence.",https://www.seek.com.au/job/86350261?type=standard&ref=search-standalone&origin=cardTitle#sol=6c2aba8d77d12fb6c01e56b1af1fa1f7ba036513
