Title,Company,Location,Short Description,Link
Business Analyst,SustainRecruit,Collingwood,Help shape digital healthcare experiences. BA role in agile team improving patient management platforms. Perm role,https://www.seek.com.au/job/85821310?type=standard&ref=search-standalone&origin=cardTitle#sol=677016aa83a21632db3b21097f8c6f87d126a1a7
"Senior Manager, Analytics & Automation",Abbott Australasia Pty Ltd,Macquarie Park,Looking for a Sales Force Analytics and Insights Manager to join our nutrition team,https://www.seek.com.au/job/85900108?type=standard&ref=search-standalone&origin=cardTitle#sol=e034ce0693ebc2e16e93dee37bcf4457f0df339e
Junior / Graduate Data Analyst - SQL / Power BI / Python - Fed Govt,HiTech Personnel,Canberra ACT,"Graduate Analyst role – join a high-profile Federal Gov dept, analyse critical data, influence security outcomes. 12+12mth contract.",https://www.seek.com.au/job/86348624?type=standard&ref=search-standalone&origin=cardTitle#sol=47db4a679dea68469144770aeca374ae84ec1eb5
Data Engineer and Analytics Officer,Bega Valley Shire Council,Bega,"Responsible for the development, integrity, maintenance, support of BVSC's corporate analytics, integration, automation and AI solutions.",https://www.seek.com.au/job/86272184?type=standard&ref=search-standalone&origin=cardTitle#sol=75d031bcc83000c3380973f1426d8e64dc8d838c
Improvement and Implementation Lead,Sunshine Coast Hospital and Health Service,Maroochydore,The opportunity to change people's lives and make a difference. Popular location. Professional development and attractive package offered.,https://www.seek.com.au/job/86049741?type=standard&ref=search-standalone&origin=cardTitle#sol=3bae35d7519443c6d25ddc3437e1467e8b5ce1e0
Data & Integration Lead,Mars Recruitment,Macquarie Park,"Lead integration and data projects in aged care. Hands-on role delivering modern data solutions, governance, and stakeholder engagement.",https://www.seek.com.au/job/85956099?type=standard&ref=search-standalone&origin=cardTitle#sol=544719614d4d940619480e9bbf56210bd24c5597
Clinical Trials Assistant,Alfred Health,Melbourne VIC,"6 months contract (possibility to extend) 
Full Time: 76 hours per FN
Classification: HS2
Flexibility work from home and office
Staff benefits",https://www.seek.com.au/job/86137260?type=standard&ref=search-standalone&origin=cardTitle#sol=733db088381ff38eddf908041732c0e9de0e31c4
"Administration Support Officer, Queensland Health",Department of Health - Queensland,Woolloongabba,Are you an experienced administrator with a talent for efficiency and organisation? We're looking for a person who has what it takes to support our...,https://www.seek.com.au/job/86221542?type=standard&ref=search-standalone&origin=cardTitle#sol=5cea73eced10d60e85389b823b059bed41ce2bfa
Strategic Business Intelligence Lead,Nextt Group Pty Ltd,Darlinghurst,Join Nextt's transformation! Help turn real-time data into impact as we roll out Salesforce and support people to live their best lives.,https://www.seek.com.au/job/86346211?type=standard&ref=search-standalone&origin=cardTitle#sol=9e0002f151cb178b26aff336d88c6de24f2f79a0
APS5 & APS6 Business Analysts,Randstad - Business Support,Melbourne VIC,We are seeking several Business Analysts (APS5 & APS6) to join a large federal government agency and play a key part in their mission.,https://www.seek.com.au/job/86177378?type=standard&ref=search-standalone&origin=cardTitle#sol=3d85e3ddeab455e3430768dcb35a78fd0f0ee1c5
Senior Manager Sourcing Analytics,Hays | Procurement,Melbourne VIC,Our public sector client is looking for a Senior Manager of Sourcing Analytics.,https://www.seek.com.au/job/86136081?type=standard&ref=search-standalone&origin=cardTitle#sol=2a090aea52c3459caabd24073931ac452276d9d7
"Senior Project Officer (Clinical Information Specialist, Register of Congenital",Ministry of Health,Sydney NSW,Join our Centre for Epidemiology and Evidence at the NSW Ministry of Health for an exciting 12-month temporary full-time opportunity.,https://www.seek.com.au/job/86270271?type=standard&ref=search-standalone&origin=cardTitle#sol=2bbbfac6190fa383a67c7315948a6de19f3d523c
Research Officer - Australia Dementia Network Registry,Monash University,Melbourne VIC,More than an admin role — it’s an opportunity to be part of a national research initiative that’s transforming the way dementia care is delivered,https://www.seek.com.au/job/86357596?type=standard&ref=search-standalone&origin=cardTitle#sol=6f32d65827ae4940320ec39456d5cf9e4ec6d118
Manager -Business Intelligence & Analytics,Milestone Information Technology,Melbourne VIC,"Milestone IT is excited to partner with a respected organisation in the healthcare sector to find an experienced Manager, Business Intelligence & A...",https://www.seek.com.au/job/86222614?type=standard&ref=search-standalone&origin=cardTitle#sol=ac115bf5f725161535e9530df8f749f458f600bf
Senior Clinical Coder,Metro North Hospital & Health Service,Redcliffe,"Permanent part time opportunity under the direction of the Senior Health Information Manager Data Services, guide and mentor the clinical coders",https://www.seek.com.au/job/86173872?type=standard&ref=search-standalone&origin=cardTitle#sol=d1420fe2fdd62f370f61f034c74c2f938d6392fd
ICT Planning and Performance Analyst - DMN653479,Metro North Hospital & Health Service,Fortitude Valley,Contribute to the strategic direction of digital health across Metro North by leveraging your analytical expertise and capacity planning capabilities.,https://www.seek.com.au/job/86301262?type=standard&ref=search-standalone&origin=cardTitle#sol=61ead0b5d26acbe4ee25b04cfdb76abfb73f0a33
"Business Analyst, Data & Operations",Catholic Early EdCare,Paddington,Drive impact through data. Use your analytics skills to improve outcomes across early learning services across SEQ.,https://www.seek.com.au/job/86333064?type=standard&ref=search-standalone&origin=cardTitle#sol=899cd79229fbb3aef72f973611a8440115b5a27f
"Senior Health Funding Analyst, Queensland Health",Department of Health - Queensland,Beaudesert,"Logan and Beaudesert Hospitals are looking for a Senior Health Funding Analyst to join their collaborative, supportive and dynamic team!
Your new...",https://www.seek.com.au/job/86190009?type=standard&ref=search-standalone&origin=cardTitle#sol=7b2ee4e1297a7bf7df1ddf58042bf3150ba4572b
Policy & Research Officer,The Council of Ambulance Authorities,Hilton,"If you're passionate about meaningful work in health policy, thrive on research and collaboration, we’d love to hear from you.",https://www.seek.com.au/job/86221891?type=standard&ref=search-standalone&origin=cardTitle#sol=eb7cdcf442a0e68d6641dec9e1a39aae4f2ba1f7
Research Associate in Public Health,Flinders University,Bedford Park,"Support NHMRC-funded research in Population Health through data analysis, publications, and funding applications.",https://www.seek.com.au/job/86302739?type=standard&ref=search-standalone&origin=cardTitle#sol=388bc09a8c7c80c3ba88f7ea01c561e980962297
Procurement Analyst,Chris O'Brien Lifehouse,Camperdown,"Manage procurement data, update inventory & procurement catalogues, analyse data, identify cost-savings & support strategic sourcing initiatives",https://www.seek.com.au/job/86244666?type=standard&ref=search-standalone&origin=cardTitle#sol=e808af3190704fb368118961cb44913ba7444390
Reporting Analyst,Allianz Australia Insurance Ltd,Adelaide SA,"Analyze claims performance, develop Power BI reports, automate dashboards, liaise with stakeholders, and drive reporting changes at Allianz.",https://www.seek.com.au/job/86079607?type=standard&ref=search-standalone&origin=cardTitle#sol=bb59ad9b7438403b5dd438c41893b6275a2a09c3
Research Coordinator,Wesley Mission Queensland,Chermside,"WMQ is seeking a Research Coordinator  to enhance the implementation, coordination and operational effectiveness of research projects and partnerships",https://www.seek.com.au/job/85980823?type=standard&ref=search-standalone&origin=cardTitle#sol=8799bc5817817b020bce5525565b5a297a8bc234
"Senior Project Officer, Queensland Health",Department of Health - Queensland,Herston,"As the Senior Project Officer, you will collaborate with stakeholders from across Queensland Health, and non-government, private and...",https://www.seek.com.au/job/86256195?type=standard&ref=search-standalone&origin=cardTitle#sol=1c856fe9f99af65fb46ea3008de1953c36f8e463
Business Analyst,Health Partners,Adelaide SA,We’re looking for a passionate and adaptable Business Analyst to join our local team on a 12-month fixed term contract!,https://www.seek.com.au/job/86226721?type=standard&ref=search-standalone&origin=cardTitle#sol=526a4eb11f32adf3f5cf4acb1c0ae45a21d337e7
"Business Practice Improvement Officer, Queensland Health",Department of Health - Queensland,Toowoomba,Are you a strategic thinker with a passion for improving healthcare systems and patient outcomes? Join Darling Downs Health as a Business Practice...,https://www.seek.com.au/job/86131883?type=standard&ref=search-standalone&origin=cardTitle#sol=b69ff920d88e6bc208573a2165bafc9e7ef00383
Patient Safety Officer - Health Practioner and Clinical Nurse Consultant,Metro South Health,Brisbane QLD,The purpose of this role is to provide clinical expertise and consultancy through advanced clinical leadership relevant to Clinical Governance.,https://www.seek.com.au/job/86336247?type=standard&ref=search-standalone&origin=cardTitle#sol=4496a957c37b1aa0c830b16be9658c6cdc0db378
"Statutory Reporting and Data Integrity Mental Health, Health Information Manager",Albury Wodonga Health,Wangaratta,"The Statutory Reporting and Data Integrity Mental Health, Health Information Manager will be a valued member of Health Information Team",https://www.seek.com.au/job/86285176?type=standard&ref=search-standalone&origin=cardTitle#sol=a70a436ac4f98e742bac6b6b8a36832ecfd18af8
"APS6 National Hand Hygiene Initiative Coordinating Officer, IPC",Australian Commission on Safety and Quality in Health Care,Sydney NSW,"This role ensures the operation of the NHHI online systems, the currency of resources and providing operational support for the NHHI LMS and HHCApp",https://www.seek.com.au/job/86052864?type=standard&ref=search-standalone&origin=cardTitle#sol=152767867ff7dbb75046a1e639f8faa220ac02ea
Senior Data Engineer,Healthcare Logic,Bundall,"If you’re passionate about data with purpose and want to see your work directly improve healthcare systems, this is your moment.",https://www.seek.com.au/job/86080143?type=standard&ref=search-standalone&origin=cardTitle#sol=d3a39a905cc7a3184e156a0d798acf24b451dc02
